title,source,published,content,sentiment,geo_risk_score,geo_risk_level,energy_risk,investment_recommendation,risk_enc,sentiment_enc,energy_enc,target,confidence_score_%
"Shell Enterprise Technology Analysis Report 2025: Digital Transformation Strategies, Innovation Programs, Technology Initiatives, Partnerships, Investment & Acquisition, Network Map",GlobeNewswire,2026-02-25T09:04:00Z,"Shell's market opportunities stem from its diversified energy portfolio, embracing digital transformation, innovation programs, extensive global distribution, and strong LNG and biofuel projects. Its focus on technology initiatives, partnerships, and sustaina…",Positive,0,Low,True,"Buy Equities, Banking, IT",1,2,1,0,100.0
"Chevron Enterprise Technology Analysis Report 2025: Accelerators, Digital Strategies, Innovation Programs, Incubators, Technology Initiatives, Partnerships, Investment & Acquisition, Network Map",GlobeNewswire,2026-02-25T09:03:00Z,"Chevron Corp presents market opportunities through its digital transformation, innovation programs, and technology initiatives, focusing on partnerships, product launches, and strategic investments. Its global presence and diverse operations offer avenues for…",Neutral,0,Low,False,Market Neutral | Hold Positions,1,1,0,4,100.0
A poetry collection inspired by a shouting match wins $100k prize,ABC News (AU),2026-02-25T09:00:00Z,"Eveyln Araluen has taken out the top award at the Victorian Premier's Literary Awards for The Rot, the follow up to her award-winning debut, Dropbear.",Positive,1,Medium,False,Selective Equity Buy | Hold Gold,2,2,0,5,90.0
UK announces biggest sanctions package against Russia four years on from full-scale invasion of Ukraine,Globalsecurity.org,2026-02-25T08:54:56Z,"The UK has announced a landmark sanctions package, cutting off critical oil revenues and further degrading the Kremlin's ability to wage its illegal war.",Negative,3,High,True,"Strong Buy: Gold, Oil & Energy Stocks | Avoid Equities",0,0,1,6,59.0
Russia and Iran Slashing Prices to China as Oil Piles Up at Sea,Financial Post,2026-02-25T08:50:49Z,Russian and Iranian oil producers are offering deepening discounts as they compete for the same limited group of Chinese buyers after India retreated from purchases.,Neutral,0,Low,True,Market Neutral | Hold Positions,1,1,1,4,100.0
"Gas imports hiked ahead of elections, no shortage expected: NOC",Mypeoplesreview.com,2026-02-25T08:45:00Z,"Kathmandu, Feb 25: With the upcoming elections in mind, the Nepal Oil Corporation has increased imports of cooking LPG. The […]
The post Gas imports hiked ahead of elections, no shortage expected: NOC appeared first on Peoples' Review.",Neutral,0,Low,True,Market Neutral | Hold Positions,1,1,1,4,100.0
Are expensive shampoos worth it? What the experts have to say,NBC 5 Dallas-Fort Worth,2026-02-25T08:33:26Z,Experts say affordable shampoos and conditioners found in grocery stores and pharmacies can do the job as well as the pricey versions.,Neutral,0,Low,False,Market Neutral | Hold Positions,1,1,0,4,100.0
How to choose the right shampoo without wasting money,The-independent.com,2026-02-25T08:31:34Z,Shampoos and conditioners can run from a few dollars to more than $100,Positive,0,Low,False,"Buy Equities, Banking, IT",1,2,0,0,100.0
"IT under pressure, energy & bank PSUs may deliver 25–30% upside: Gautam Shah",The Times of India,2026-02-25T08:09:25Z,"IT stocks face structural headwinds, with valuations and AI disruption posing risks, according to Gautam Shah. He advises against catching falling knives in IT, predicting Nifty IT's potential fall to 26,000. Instead, he favors PSU banks, metals, and energy s…",Positive,0,Low,True,"Buy Equities, Banking, IT",1,2,1,0,100.0
Kazakh businessman Kenges Rakishev Consolidates Oil and Gas Assets Into Fincraft Energy Holding,GlobeNewswire,2026-02-25T07:37:00Z,"Kenges Rakishev, president of the Fincraft Group, has transferred two companies into oil and gas conglomerate Fincraft Energy Holding Limited....",Neutral,0,Low,True,Market Neutral | Hold Positions,1,1,1,4,100.0
MPC’s modest rate cut sends positive signal – OPS,The Punch,2026-02-25T07:22:33Z,"Nigeria’s MPC cuts the interest rate to 26.5%, a move the Organised Private Sector sees as a modest but positive signal for economic growth and stability.

Read More: https://punchng.com/mpcs-modest-rate-cut-sends-positive-signal-ops/",Positive,0,Low,False,"Buy Equities, Banking, IT",1,2,0,0,100.0
Understanding intersection between you and new tax laws,The Punch,2026-02-25T07:04:03Z,"A simple guide to Nigeria’s new tax laws. Understand how the Tax Act impacts individuals, SMEs, digital assets, VAT, and more. Key changes explained.

Read More: https://punchng.com/understanding-intersection-between-you-and-new-tax-laws-2/",Positive,0,Low,False,"Buy Equities, Banking, IT",1,2,0,0,100.0
GPS Tracking Device Market Size to Exceed $14.78 Billion by 2035 | SNS Insider,GlobeNewswire,2026-02-25T07:00:00Z,"Global GPS Tracking Device Market Size, Share, Revenue Trends & Segmentation Analysis Report, By Type, Deployment, Industry, Regions | Forecast 2026-2035...",Neutral,0,Low,False,Market Neutral | Hold Positions,1,1,0,4,100.0
Accelerating American (and Planetary) Decline,CounterPunch,2026-02-25T06:56:10Z,"Some tales can cross cultures, continents, and even centuries to arrive in our own era with their timeless truths pretty much intact. That’s particularly so for the immortal story of “an appointment in Samarra.” It first appeared in the fifth century in the B…",Positive,0,Low,False,"Buy Equities, Banking, IT",1,2,0,0,100.0
Bureau Veritas: Sector-Leading Organic Revenue Growth of 6.5% in FY 2025,Financial Post,2026-02-25T06:32:16Z,"Strong margin improvement to 16.3% in FY 2025 Positive growth outlook with continued margin expansion in 2026 New EUR 200 million share buyback COURBEVOIE, France — Bureau Veritas (BOURSE:BVI): 2025 key figures1 › Full-year revenue of EUR 6,466.4 million, up …",Positive,0,Low,False,"Buy Equities, Banking, IT",1,2,0,0,100.0
Key takeaways from Trump’s State of the Union speech,Al Jazeera English,2026-02-25T06:30:20Z,"Trump's hardline stance on Iran and nuclear weapons, alongside foreign policy moves, dominate key moments of his speech.",Neutral,1,Medium,False,Hold Gold | Avoid High-Risk Equities,2,1,0,3,95.0
"BUREAU VERITAS - Sector-leading organic revenue growth of 6.5% in FY 2025, strong margin improvement to 16.3% in FY 2025, positive growth outlook with continued margin expansion in 2026 and new EUR 200 million share buyback",GlobeNewswire,2026-02-25T06:30:00Z,"PRESS RELEASE  Courbevoie, France – February 25, 2026  Sector-leading organic revenue growth of 6.5% in FY 2025  Strong margin improvement to 16.3% in FY...",Positive,0,Low,False,"Buy Equities, Banking, IT",1,2,0,0,100.0
Six takeaways from Trump's 2026 State of the Union address to Congress – the longest one in history,Independent.ie,2026-02-25T06:27:32Z,"President Donald Trump delivered his State of the Union address to a joint session of Congress on Tuesday, a potentially pivotal moment as the White House seeks to firm up support among Republican voters ahead of November's midterm elections.",Neutral,0,Low,False,Market Neutral | Hold Positions,1,1,0,4,100.0
Read Trump's 2026 State of the Union address,NPR,2026-02-25T06:07:40Z,Read President Trump's State of the Union delivered on Feb. 14.,Neutral,0,Low,False,Market Neutral | Hold Positions,1,1,0,4,100.0
Energy price cap to fall in April but threat of war hangs over outlook,Sky.com,2026-02-25T06:00:00Z,"Sky's James Sillars writes that while some policy costs have been stripped from bills, we're still paying for them elsewhere at a time when we continue to rely on gas for our power and heating.",Neutral,1,Medium,True,Hold Gold | Avoid High-Risk Equities,2,1,1,3,98.0
"Carbon capture pipelines can rupture, shooting plumes of asphyxiating gas into the atmosphere",Naturalnews.com,2026-02-25T06:00:00Z,"Imagine a network of massive pipes, wider than a person is tall, snaking through the quiet countryside and edging past towns. Their proposed cargo isn’t water or fuel, but carbon dioxide, captured from factories and pumped under the sea. Promoted as a vital w…",Neutral,0,Low,True,Market Neutral | Hold Positions,1,1,1,4,100.0
Vopak reports record financial results for 2025 and announces shareholder distributions program of around EUR 1.7 billion through year-end 2030,GlobeNewswire,2026-02-25T06:00:00Z,"The Netherlands, 25 February 2026   Vopak reports record financial results for 2025 and announces shareholder distributions program of around EUR 1.7...",Neutral,0,Low,False,Market Neutral | Hold Positions,1,1,0,4,100.0
